product_name,sentiment,brewing_method,review_text,date,tasting_notes
Caffe Luna,liked,Pour Over,"Smooth and rich. If you are looking non acidic dark smooth coffee, this is a must try.",10/18/2023,"Dark Chocolate, S'more, Almond"
Caffe Luna,liked,Aeropress,,07/27/2022,"Dark Chocolate, S'more, Almond"
Caffe Luna,disliked,French Press,bad about this coffee but nothing special. If I could give a neutral I would. I would drink it again if served but given the other coffees I have tried that were better marking this as a dislike.,07/12/2022,"Dark Chocolate, S'more, Almond"
Caffe Luna,disliked,Pour Over,this over a week late so it wasn’t as super fresh as it could be. Also living in Arizona I’d imagine the heat during being shipped could effect it. Unfortunately I wasn’t able to taste any of the delicious notes it has.,07/04/2022,"Dark Chocolate, S'more, Almond"
Caffe Luna,liked,Drip,Delizioso,06/29/2022,"Dark Chocolate, S'more, Almond"
Caffe Luna,liked,Aeropress,,06/27/2022,"Dark Chocolate, S'more, Almond"
Caffe Luna,liked,Drip,Love it!,06/19/2022,"Dark Chocolate, S'more, Almond"
Caffe Luna,liked,Pour Over,,06/17/2022,"Dark Chocolate, S'more, Almond"
Caffe Luna,liked,Drip,Really good...flavorvul,05/16/2022,"Dark Chocolate, S'more, Almond"
Caffe Luna,liked,Espresso Machine,,05/11/2022,"Dark Chocolate, S'more, Almond"
Caffe Luna,liked,Drip,"Sharp, but not bitter. Like drinking a well balanced campfire s’mores notes come through.",04/14/2022,"Dark Chocolate, S'more, Almond"
Caffe Luna,liked,French Press,like dark try the Caffe Luna!! Fresh hand grind then French Press gave us a real pleasure every morning. Will definitely buy this again,04/05/2022,"Dark Chocolate, S'more, Almond"
Sugar Bee Espresso,disliked,Espresso Machine,"a medium dark roast, unlike advertised. I wanted to like this, but after experimenting with several grind settings, I still found this a tad bit bitter. If the roast was just a bit lighter, this would’ve been great.",03/30/2023,"Sweet, Syrup, Chocolate, Fruit"
Sugar Bee Espresso,liked,Espresso Machine,Great !,05/03/2022,"Sweet, Syrup, Chocolate, Fruit"
Sugar Bee Espresso,liked,Espresso Machine,"they say it is, but one of the best darker roasted espresso I've had on bottomless. They really nail that syrupy flavor without too much bitter roasty flavors and a pleasant sweetness holding it together. Was very sensitive to water quality, and suprisingly seemed to pull better flavored shots around 3-6 days old than the typical.8-11 day old ones",04/13/2022,"Sweet, Syrup, Chocolate, Fruit"
Sugar Bee Espresso,liked,Espresso Machine,It’s good,04/09/2022,"Sweet, Syrup, Chocolate, Fruit"
Sugar Bee Espresso,liked,Drip,Nice and smooth,04/03/2022,"Sweet, Syrup, Chocolate, Fruit"
Sugar Bee Espresso,liked,Superautomatic Espresso Machine,Delicious,03/29/2022,"Sweet, Syrup, Chocolate, Fruit"
Sugar Bee Espresso,disliked,Espresso Machine,,03/08/2022,"Sweet, Syrup, Chocolate, Fruit"
Sugar Bee Espresso,liked,Espresso Machine,Typical Espresso,03/02/2022,"Sweet, Syrup, Chocolate, Fruit"
Sugar Bee Espresso,liked,Espresso Machine,Great balance,04/19/2021,"Sweet, Syrup, Chocolate, Fruit"
Snow Joe,liked,Pour Over,,09/08/2022,"Cocoa, Spice, Almond"
Narwhal Blend,disliked,Pour Over,"I received was not a light roast, it is more of a medium-dark roast. Brewing at lower temperatures helps fix some of the bitter notes from coming through but overall not the coffee for me. Brewed in a Hario Switch and a Fellow Aiden.",06/08/2025,"Milk Chocolate, Cherry, Nougat, Sugar Cane"
Narwhal Blend,liked,Cold Brew,,08/10/2024,"Milk Chocolate, Cherry, Nougat, Sugar Cane"
Narwhal Blend,liked,French Press,very pleasant cup for me. What I came here to say it that they threw in a matching single serve Steeped coffee colaboration product that just is really amazing.,03/02/2024,"Milk Chocolate, Cherry, Nougat, Sugar Cane"
Narwhal Blend,liked,Espresso Machine,,04/13/2022,"Milk Chocolate, Cherry, Nougat, Sugar Cane"
Mexico Santa Fe,liked,Drip,,11/25/2024,
Mexico Santa Fe,disliked,Aeropress,,03/11/2024,
Mexico Santa Fe,liked,Pour Over,super yumz,04/25/2022,
Little Buddy,disliked,Espresso Machine,"Wayyyy too light for espresso. If you like light coffee, this is for you.",10/22/2025,"Stone Fruit, Flowers, Berry"
Little Buddy,disliked,Espresso Machine,Too light for my taste but my family loved it.,08/24/2025,"Stone Fruit, Flowers, Berry"
Little Buddy,disliked,Espresso Machine,grind this fine enough for an espresso shot. All my shots were about 12-15 seconds with the finest grind available. 18g in and 36g out. Would not request again.,05/18/2025,"Stone Fruit, Flowers, Berry"
Little Buddy,disliked,Espresso Machine,,07/27/2024,"Stone Fruit, Flowers, Berry"
Little Buddy,liked,Espresso Machine,"make americanos, and this was a great blend. Easier to dial in than single origin, but still a great body! Photos:",11/16/2023,"Stone Fruit, Flowers, Berry"
Little Buddy,liked,Espresso Machine,Delicious in lattes!,06/25/2022,"Stone Fruit, Flowers, Berry"
Little Buddy,liked,Espresso Machine,"Bold, strong flavor if you like Ethiopian style beans. Great for espresso and drip.",06/10/2022,"Stone Fruit, Flowers, Berry"
Little Buddy,disliked,Espresso Machine,"one note, not my favorite flavors.",06/01/2022,"Stone Fruit, Flowers, Berry"
Little Buddy,liked,Espresso Machine,Great for espresso,05/16/2022,"Stone Fruit, Flowers, Berry"
Little Buddy,liked,Espresso Machine,One of my all time favorites so far.,05/05/2022,"Stone Fruit, Flowers, Berry"
Little Buddy,liked,Espresso Machine,"Loved this one, excellent profile",05/02/2022,"Stone Fruit, Flowers, Berry"
Brazil Carmo De Minas,disliked,French Press,,09/10/2023,"Lemon, Cinnamon, Almond"
Brazil Carmo De Minas,liked,Drip,think I would like this coffee but I have been pleasantly surprised. This cup is mellow and flavorful with a mild roast. Highly recommend even if you don't think you'll be a fan based on the notes provided.,02/02/2023,"Lemon, Cinnamon, Almond"
Brazil Carmo De Minas,disliked,Keurig,"I didn't really enjoy the taste of this one, it seemed to be more bland then other medium roast coffees I've had.",06/26/2022,"Lemon, Cinnamon, Almond"
Brazil Carmo De Minas,liked,Pour Over,Great brightness and full taste. Hated the bag though. Ripped day one,06/22/2022,"Lemon, Cinnamon, Almond"
Brazil Carmo De Minas,disliked,Stovetop Percolator,"a bad run with Brazilian coffees, to my surprise. Meh coffee - while decently strong, it doesn't have much flavour to speak of.",06/16/2022,"Lemon, Cinnamon, Almond"
Brazil Carmo De Minas,disliked,Drip,Not a strong enough flavor.,05/12/2022,"Lemon, Cinnamon, Almond"
Brazil Carmo De Minas,disliked,Drip,Too fruity,04/28/2022,"Lemon, Cinnamon, Almond"
Brazil Carmo De Minas,disliked,Aeropress,"Dark and bitter, just not to my liking.",03/10/2022,"Lemon, Cinnamon, Almond"
Brazil Carmo De Minas,liked,Pour Over,from my random rotation from 7 roasters. I'm not good at describing coffee notes but this one stands out!!!,03/07/2022,"Lemon, Cinnamon, Almond"
Big Truck,liked,Espresso Machine,"wasn't anything wrong with this espresso, it wasn't particularly remarkable either. The one area where it did stand out against competitors was texture. Understandable that this is the roasters sort of signature blend,given how accessible it is. Ground at 16.5 on a Niche Zero and extracted 19g in 38 out in 25-30 seconds on a Flair 58",02/26/2024,"Berry, Sweet, Chocolate"
Big Truck,liked,Mokapot,"Delicious brewed any way, but extra good in a Mokapot! Very full flavor.",09/20/2023,"Berry, Sweet, Chocolate"
Big Truck,liked,Superautomatic Espresso Machine,"Really good, strong notes of blueberry.",09/06/2023,"Berry, Sweet, Chocolate"
Big Truck,disliked,Drip,"for me. The fruit / tart flavor definitely shows through. It's alright for a coffee, not my favorite or least favorite.",05/31/2023,"Berry, Sweet, Chocolate"
Big Truck,liked,Espresso Machine,Solid. I also have liked this roaster's other coffees.,05/28/2023,"Berry, Sweet, Chocolate"
Big Truck,liked,Espresso Machine,,05/15/2023,"Berry, Sweet, Chocolate"
Big Truck,liked,Espresso Machine,Very good,07/27/2022,"Berry, Sweet, Chocolate"
Big Truck,disliked,Espresso Machine,Too fruity for me,06/24/2022,"Berry, Sweet, Chocolate"
Big Truck,disliked,Drip,After drink this roast over learned I don't care for berries flavor,06/21/2022,"Berry, Sweet, Chocolate"
Big Truck,liked,Superautomatic Espresso Machine,Iits been a great smooth tasting coffee. I definitely buy it again.,05/29/2022,"Berry, Sweet, Chocolate"
Big Truck,disliked,Superautomatic Espresso Machine,Leans too bitter,05/17/2022,"Berry, Sweet, Chocolate"
Big Truck,liked,Moccamaster,Lovely clean balanced brew,03/23/2022,"Berry, Sweet, Chocolate"
Big Truck,liked,Espresso Machine,Well balanced,03/23/2022,"Berry, Sweet, Chocolate"
Big Truck,disliked,Espresso Machine,"enjoy floral notes, this is a great choice for you! I was unsure if I liked floral hints in my medium roast blend but I found out that this wasn’t my preference. The coffee itself wasn’t bad, but I didn’t love the floral taste at the end. I would say this blend is better equipped for those who have a broad flavor profile and can appreciate the unique taste this coffee offers. Another note: this blend would probably make a wonderful lavender latte!",02/25/2022,"Berry, Sweet, Chocolate"
Big Truck,liked,Espresso Machine,Really nicely balanced espresso with chocolatey notes. Definitely recommend.,05/03/2021,"Berry, Sweet, Chocolate"
Big Truck,liked,Moccamaster,"4 for the machine, 6 for Chemex",05/30/2020,"Berry, Sweet, Chocolate"
Organic Espresso,liked,Espresso Machine,Lovr this coffee,09/26/2025,"Blueberry, Brown Sugar, Chocolate"
Cafe Carmelita Decaf,liked,Hario switch mixed immersion & percolation,& percolation This has been such a great coffee! The flavors are rich and complex but not heavy. Clean and clear on the palette with good sweetness and acidity balance. Very glad I tried this.,08/14/2025,"Caramel, Cocoa, Butter"
French Royale,liked,Pour Over,"At first I thought it was too bitter, but it's really grown on me!",03/04/2024,
French Royale,liked,French Press,"MY FAV COFFEE! I have searched for others on your website, and non are comparable! It is the right combo of bold dark bitter roast and sweetness. And the aroma - Mmmmmmmm!",01/17/2023,
French Royale,liked,Pour Over,Delicious and bold,12/03/2022,
French Royale,liked,Pour Over,Good strong coffee and smell,10/31/2022,
French Royale,liked,Superautomatic Espresso Machine,"Excellent...dark, shiny beans seem to brew the kind of cup I really enjoy.",07/27/2022,
French Royale,liked,Pour Over,A perfect cup of coffee!,04/07/2022,
Mwendi Wega AA - Kenya,liked,Pour Over,Makes for a delightfully smooth cup of coffee.,10/06/2023,"Cola, Blackberry, Grapefruit"
Upland,disliked,Drip,"for me! Definitely a dark roast, not medium like advertised. Bitter and nothing like the taste thats described. It's really acidic too. Not a fan at all",01/23/2023,"Milk Chocolate, Almond, Sweet"
Upland,liked,Drip,,07/18/2022,"Milk Chocolate, Almond, Sweet"
Upland,disliked,Pour Over,Was not for me,06/19/2022,"Milk Chocolate, Almond, Sweet"
Deja Vu,disliked,Pour Over,"Blossom Coffee Roasters' Deja Vu, and it's like sipping on a cozy chocolate hug. Brewed it with both a Kalita Wave and a drip machine - both ways were delicious. The Kalita gave me a rich, smooth cup with deep cacao vibes and a touch of caramel sweetness. The drip was lighter but still packed with that melted chocolate flavor. If you’re into bold, chocolaty coffee, this won't disappoint.",09/07/2024,"Chocolate, Sugar, Smoke"
Deja Vu,liked,Moccamaster,has become my favorite. I believe I am on my 4th coffee from them and have really enjoyed all of them. I have just received as a one off purchase my first DECAF coffee from Bottomless and ordered from Blossum because I knew it would be good. My next regular bag is due to arrive 2 days and I look forward to it.,12/07/2023,"Chocolate, Sugar, Smoke"
Deja Vu,liked,Drip,The best I’ve had from bottomless so far,07/24/2023,"Chocolate, Sugar, Smoke"
Deja Vu,liked,Pour Over,Very smooth with a nice light aftertaste,07/25/2022,"Chocolate, Sugar, Smoke"
Deja Vu,liked,Aeropress,"Flavorful, a little dark for me, but brews well.",07/19/2022,"Chocolate, Sugar, Smoke"
Deja Vu,liked,Pour Over,love this one,07/01/2022,"Chocolate, Sugar, Smoke"
Deja Vu,liked,Espresso Machine,Best coffee yet,06/25/2022,"Chocolate, Sugar, Smoke"
Deja Vu,liked,French Press,This coffee is one of the best I’ve received so far! The chocolatey undertones 🤌😘,04/29/2022,"Chocolate, Sugar, Smoke"
Ratu Ketiara Women's Cooperative,disliked,Pour Over,"with both v60 and moccamaster, didn't get much more than an average cup of coffee... which is luckily still pretty damn good, but not repeatable.",09/15/2025,"Dark Chocolate, Caramel, Dark Cherry"
Ratu Ketiara Women's Cooperative,liked,Moccamaster,Beautiful coffee.,02/21/2023,"Dark Chocolate, Caramel, Dark Cherry"
Streamline Espresso Blend,liked,Espresso Machine,,10/06/2023,"Hazelnut, Cocoa, Blueberry"
Streamline Espresso Blend,liked,Espresso Machine,,07/25/2022,"Hazelnut, Cocoa, Blueberry"
Streamline Espresso Blend,liked,Espresso Machine,,07/02/2022,"Hazelnut, Cocoa, Blueberry"
Streamline Espresso Blend,disliked,Superautomatic Espresso Machine,"The taste is interesting. Different. Not unpleasant, but not my thing. Not a fan of the aftertaste.",05/30/2022,"Hazelnut, Cocoa, Blueberry"
Streamline Espresso Blend,liked,Espresso Machine,Really creamy and delicious.,05/18/2022,"Hazelnut, Cocoa, Blueberry"
Streamline Espresso Blend,liked,Espresso Machine,Very smooth and flavorful with milk!,05/11/2022,"Hazelnut, Cocoa, Blueberry"
Sumatra Mandheling Old School,liked,French Press,"what I normally drink, but wanted to give it a try for the interesting tasting notes. Good for the price point/roast level. This is not your cup if you are looking for something bright and nuanced. This is for the full body, smokey, bitter dark chocolate people.",03/02/2024,"Chocolate, Cedar, Cucumber"
Sumatra Mandheling Old School,liked,Pour Over,Good flavor,07/04/2022,"Chocolate, Cedar, Cucumber"
Ethiopia Yirgachefe,liked,Pour Over,"After a 4.30 Chemex pour over, I picked up some delicate floral notes, a little walnut, and even a hint of Cinnamon",03/10/2024,"Jasmine, Berry, Wine"
Ethiopia Yirgachefe,liked,Drip,,06/27/2023,"Jasmine, Berry, Wine"
Ethiopia Yirgachefe,disliked,Cold Brew,"dismissing. This roast was very unique, we did not like it hot. However, I discovered that this roast cold brewed was very good. The flavor on the cold side was completely different. If you want cold brew, I’d recommend this.",09/22/2022,"Jasmine, Berry, Wine"
Ethiopia Yirgachefe,liked,Pour Over,so far this has been my favorite bag -- so smooth with subtle flavors,05/15/2022,"Jasmine, Berry, Wine"
Ethiopia Yirgachefe,liked,Drip,good. I found it doesn't pair well with milk. I tend to love my Ethiopian coffees but this was one was just okay.,05/12/2022,"Jasmine, Berry, Wine"
Empire Blend,liked,Aeropress,,07/14/2022,"Fruit, Sugar"
Empire Blend,liked,Pour Over,,07/11/2022,"Fruit, Sugar"
Empire Blend,liked,Drip,,05/30/2022,"Fruit, Sugar"
Decaf Ethiopia,liked,Mocapot,So good! First cup that doesn't make me miss being able to drink regular coffee,09/30/2023,"Blueberry, Graham Cracker, Flowers"
Decaf Ethiopia,liked,Espresso Machine,,02/01/2023,"Blueberry, Graham Cracker, Flowers"
Decaf Ethiopia,liked,Pour Over,"roast; toasted sugars, mild and balanced acidity; mild blackberry and jasmine; thin body, low complexity; moderate bitterness in the finish I couldn’t dial away (preferred grind on Preciso: 12A)",10/11/2022,"Blueberry, Graham Cracker, Flowers"
Decaf Ethiopia,liked,Espresso Machine,"Cracker is real... Definitely taste that, I think more than the blueberry. This has been my GO TO decaf for espresso since I like lighter/fruitier roasts!",03/06/2022,"Blueberry, Graham Cracker, Flowers"
Espresso Velluto Organic,liked,Espresso Machine,by far my favorite Photos:,11/23/2025,"Chocolate, Stone Fruit"
Espresso Velluto Organic,disliked,Espresso Machine,Full bodied espresso with overpowering bakers chocolate notes. Did not enjoy even with milk.,02/25/2024,"Chocolate, Stone Fruit"
Espresso Velluto Organic,liked,Moccamaster,This coffee is E-X-C-E-L-L-E-N-T !!!,11/03/2023,"Chocolate, Stone Fruit"
Espresso Velluto Organic,liked,Espresso Machine,,02/13/2023,"Chocolate, Stone Fruit"
Espresso Velluto Organic,liked,Drip,,02/05/2023,"Chocolate, Stone Fruit"
Espresso Velluto Organic,disliked,Espresso Machine,verry light,06/09/2022,"Chocolate, Stone Fruit"
Espresso Velluto Organic,liked,Pour Over,,05/23/2022,"Chocolate, Stone Fruit"
Espresso Velluto Organic,disliked,Superautomatic Espresso Machine,This coffee has a very earthy taste that does not fare well for espresso.,05/14/2022,"Chocolate, Stone Fruit"
Espresso Velluto Organic,disliked,Superautomatic Espresso Machine,Not a fan of the aftertaste,04/15/2022,"Chocolate, Stone Fruit"
Espresso Velluto Organic,disliked,Superautomatic Espresso Machine,Did not like,04/09/2022,"Chocolate, Stone Fruit"
Espresso Velluto Organic,liked,French Press,,04/02/2022,"Chocolate, Stone Fruit"
Espresso Velluto Organic,liked,Espresso Machine,It is wonderful,03/28/2022,"Chocolate, Stone Fruit"
Pano Hawaiian Blend,liked,Drip,So Smooth!,01/27/2026,"Macadamia, Ginger"
Pano Hawaiian Blend,disliked,French Press,"Not so much of a dark roast, pretty sour/acidic. Not a fan.",03/19/2024,"Macadamia, Ginger"
Pano Hawaiian Blend,liked,Drip,this was good nothing super special,04/04/2023,"Macadamia, Ginger"
Pano Hawaiian Blend,disliked,Aeropress,Too watery,03/21/2022,"Macadamia, Ginger"
Pano Hawaiian Blend,liked,Pour Over,I've had this through pour over and drip. Great flavor both black and with a flavor creamer. A must try,03/10/2022,"Macadamia, Ginger"
Leviathan (Espresso Blend),liked,Espresso Machine,Rich espresso with great toasty and chocolate notes.,04/07/2023,"Chocolate, Plum, Brown Sugar"
Leviathan (Espresso Blend),liked,Espresso Machine,"opinion this is the best espresso blend on bottomless. Perfectly balanced, easy to work with, and just so, so tasty.",01/04/2022,"Chocolate, Plum, Brown Sugar"
French Roast Blend,liked,Drip,Tastes like a really bold medium roast. I love it,03/23/2024,"Dark Chocolate, Sweet"
French Roast Blend,disliked,Drip,Weak and tasteless,06/06/2023,"Dark Chocolate, Sweet"
French Roast Blend,liked,Pour Over,This particular coffee produces a lot of static in our grinder.,03/19/2023,"Dark Chocolate, Sweet"
French Roast Blend,liked,Aeropress,Has more body and personality from aero press than French press. Never tried Moka pot with this roast.,09/18/2022,"Dark Chocolate, Sweet"
French Roast Blend,disliked,French Press,,07/13/2022,"Dark Chocolate, Sweet"
French Roast Blend,liked,Espresso Machine,,06/21/2022,"Dark Chocolate, Sweet"
French Roast Blend,liked,Pour Over,"Bold and smooth. A little much on the burnt part of the ""burnt sugar"" note, but otherwise fantastic.",06/09/2022,"Dark Chocolate, Sweet"
Peru Pangoa,liked,Drip,The best I’ve tasted so far. Light and nutty. Not harsh at all.,10/01/2023,"Hazelnut, Toffee"
Peru Pangoa,liked,Espresso Machine,Wonderful coffee!!,07/16/2023,"Hazelnut, Toffee"
Peru Pangoa,liked,French Press,Delicious,08/05/2022,"Hazelnut, Toffee"
Peru Pangoa,liked,French Press,Totally tasty. Light on its feet with a nutty toasty flavor.,04/17/2022,"Hazelnut, Toffee"
Peru Pangoa,liked,French Press,Very smooth and feels like it has cream in it even when black! My favorite by far and the best price!,03/19/2022,"Hazelnut, Toffee"
Classic,disliked,Drip,"Cost to quality ratio did not match. $20 for an ""everyday"" roast shouldn't be a thing.",06/29/2024,"Caramel, Chocolate, Stone Fruit, Honey"
Classic,liked,Aeropress,,11/02/2023,"Caramel, Chocolate, Stone Fruit, Honey"
Classic,liked,Drip,,01/24/2023,"Caramel, Chocolate, Stone Fruit, Honey"
Classic,disliked,Pour Over,,07/10/2022,"Caramel, Chocolate, Stone Fruit, Honey"
Classic,liked,Pour Over,"Great balance. No fuss, just a good everyday/situation coffee.",07/04/2022,"Caramel, Chocolate, Stone Fruit, Honey"
Classic,liked,Pour Over,"my favorite coffee so far... I usually do one cup in the Chemex each morning, and today I am having a second cup!",06/11/2022,"Caramel, Chocolate, Stone Fruit, Honey"
Classic,disliked,Pour Over,"as much flavor as I would have liked. I got it because the bag is super cool--unfortunately, the coffee inside didn't match the outside.",06/07/2022,"Caramel, Chocolate, Stone Fruit, Honey"
Classic,liked,French Press,"Balanced, nutty, smooth",05/08/2022,"Caramel, Chocolate, Stone Fruit, Honey"
Classic,liked,French Press,Beautiful light but full flavor.,05/05/2022,"Caramel, Chocolate, Stone Fruit, Honey"
Ethiopia Guji,disliked,Aeropress,this one as much. Seemed hollow and weak despite brewing for 4 minutes in the Aero press and grinding the beans on very fine with my manual burr grinder.,12/21/2023,"Raspberry, Tea, Sugar, Mango"
Ethiopia Guji,disliked,French Press,"ok but flavorless for some reason. I don’t know if something just went wrong and it was drinkable, just had almost no flavor. Strange.",12/10/2023,"Raspberry, Tea, Sugar, Mango"
Ethiopia Guji,disliked,Pour Over,"Just an average cup of coffee. If you want nothing crazy with your coffee, this is it.",03/21/2023,"Raspberry, Tea, Sugar, Mango"
Ethiopia Guji,liked,Pour Over,"what I’d consider the perfect coffee! It’s nose is rich, palate and finish are very smooth with very little bitterness. If you like a more fruity finish, this bag is not for you.",02/08/2023,"Raspberry, Tea, Sugar, Mango"
Ethiopia Guji,liked,Pour Over,,07/27/2022,"Raspberry, Tea, Sugar, Mango"
Ethiopia Guji,liked,Pour Over,,07/24/2022,"Raspberry, Tea, Sugar, Mango"
Ethiopia Guji,liked,Espresso Machine,,07/12/2022,"Raspberry, Tea, Sugar, Mango"
Ethiopia Guji,disliked,Drip,,07/11/2022,"Raspberry, Tea, Sugar, Mango"
Ethiopia Guji,liked,Pour Over,Delicious,07/05/2022,"Raspberry, Tea, Sugar, Mango"
Ethiopia Guji,disliked,Espresso Machine,Was not able to get the shot correct. Kept over extracting no matter how much I adjusted,06/29/2022,"Raspberry, Tea, Sugar, Mango"
Ethiopia Guji,liked,Pour Over,Close akin to a nice black tea with raspberries.,06/27/2022,"Raspberry, Tea, Sugar, Mango"
Ethiopia Guji,disliked,Pour Over,Not my favorite. A little more bitter than I'd prefer and a strong dark chocolate flavor that I don't love.,06/24/2022,"Raspberry, Tea, Sugar, Mango"
Ethiopia Guji,liked,Pour Over,"Full crisp flavor, with light bitterness on the end. This is a delightful light roast!",06/16/2022,"Raspberry, Tea, Sugar, Mango"
Ethiopia Guji,liked,Pour Over,Very smooth and to me a fruity very good ! I highly recommend it!!,06/10/2022,"Raspberry, Tea, Sugar, Mango"
Ethiopia Guji,liked,Drip,Balanced delicious,05/22/2022,"Raspberry, Tea, Sugar, Mango"
Espresso Noir,liked,Espresso Machine,trying to dial in a new Breville machine. I went through a couple bags of Starbucks I got from the store and the only way I could drink it was to drown it in milk. My first double shot of Tony's Espresso Noir was tasty. I'm happy with that.,10/15/2024,
Espresso Noir,liked,Espresso Machine,,02/18/2024,
Espresso Noir,liked,Espresso Machine,,08/01/2023,
Espresso Noir,liked,Espresso Machine,"5 lbs bag of this to try to revive my espresso journey. I am incapable of giving a highly descriptive review of this coffee as I am still in the process of trying to figure out my pallete. That is, I’m no longer just throwing some milk on top of my shots and calling it good. What I can say is this, for espresso this was seems more acidic than I would have otherwise thought. I am not saying this in a bad way, as I was actually bracing myself for a very bitter brew. The roast is clearly dark and oils can be seen on the beans, evidencing the second crack. All in all, I was pleased with this roast and think that it was an all-in-all good roast to restart my espresso journey with. I mainly buy lift roasts for drip coffee, but that stuff was straight battery acid in my espresso machine. I think this was a good all around roast for espresso.",12/30/2022,
Espresso Noir,liked,Drip,,07/18/2022,
Espresso Noir,liked,Espresso Machine,"So rich and roasty, great crema, one of my favorites so far from bottomless",07/11/2022,
Espresso Noir,liked,Espresso Machine,A nice dark roast for espresso.,06/28/2022,
Espresso Noir,disliked,Espresso Machine,"Comes across to bitter, doesn't work for me",06/20/2022,
Espresso Noir,disliked,Espresso Machine,,05/03/2022,
Triborough Blend,liked,Mix,"Nice dark, versatile, easy going",03/08/2024,"Marzipan, Bittersweet Chocolate, Caramel"
Triborough Blend,liked,Drip,,07/13/2022,"Marzipan, Bittersweet Chocolate, Caramel"
Triborough Blend,disliked,Aeropress,,07/10/2022,"Marzipan, Bittersweet Chocolate, Caramel"
Triborough Blend,liked,Drip,Solid dark roast. Don’t get wny marzipan unfortunately.,07/08/2022,"Marzipan, Bittersweet Chocolate, Caramel"
Triborough Blend,liked,Espresso Machine,"Nice rich flavor, works well in latte.",07/06/2022,"Marzipan, Bittersweet Chocolate, Caramel"
Triborough Blend,liked,Espresso Machine,Chocolatey,06/21/2022,"Marzipan, Bittersweet Chocolate, Caramel"
Triborough Blend,liked,Espresso Machine,Makes a nice espresso,06/06/2022,"Marzipan, Bittersweet Chocolate, Caramel"
Triborough Blend,liked,Espresso Machine,,04/25/2022,"Marzipan, Bittersweet Chocolate, Caramel"
Novacella Decaf,liked,Espresso Machine,,07/19/2022,"Nutmeg, Cocoa, Candied Citrus"
Novacella Decaf,liked,Pour Over,Loved this one! Dark and delicious!,06/02/2022,"Nutmeg, Cocoa, Candied Citrus"
Novacella Decaf,liked,Espresso Machine,Wife really likes the taste of this one in her latte.,05/26/2022,"Nutmeg, Cocoa, Candied Citrus"
Goodnight Moon Decaf,disliked,Pour Over,"Bitter, acidic, tart. All around, not a very enjoyable coffee...",04/06/2023,"Raspberry, Sugar, Grape"
